[
  {
    "descName": "string(STR_TRAIN_NAME_SHORT, \"TX-1000\", string(STR_NAME_SERIES))",
    "trainName": "tsukuba_1000series",
    "groupType": "semiPrivate",
    "introductionDate": "2005, 8, 24",
    "scrapYear": 0,
    "costFactor": 21,
    "runningCost": 51,
    "speed": 130,
    "trackGauge": 1067,
    "weight": [32, 31],
    "formations": [6],
    "doors": [4],
    "current": ["DC_1500"],
    "usage": ["express"],
    "operator": ["TSUKUBA"],
    "capacity": [{ "headCapacity": [147], "wagCapacity": [158] }],
    "power": [{ "powerPerMotor": 190, "blockLength": 8, "positions": [1, 3, 4] }],
    "liveries": [
      {
        "panto": {
          "variations": [
            {
              "placement": [
                { "length": 5, "positions": { "2": "mot_2", "0_REV": "mot" } },
                { "length": 3, "positions": { "0": "mot_2" } }
              ],
              "main": { "0": "0", "5": "1", "2..3": "1" }
            }
          ]
        }
      }
    ],
    "spriteSets": [
      [
        ["front", "tmpl_std (0, 0)"],
        ["end", "tmpl_std (0, 25)"],
        ["mot_2", "tmpl_symm (0, 50)"],
        ["wag", "tmpl_symm (0, 75)"],
        ["mot", "tmpl_std_rev (0, 100)"],
        ["mot_rev", "tmpl_std (0, 100)"]
      ]
    ]
  },
  {
    "descName": "string(STR_TRAIN_NAME_SHORT, \"TX-2000\", string(STR_NAME_SERIES))",
    "trainName": "tsukuba_2000series",
    "groupType": "semiPrivate",
    "introductionDate": "2005, 8, 24",
    "scrapYear": 0,
    "costFactor": 22,
    "runningCost": 52,
    "speed": 130,
    "trackGauge": 1067,
    "weight": [36, 34],
    "formations": [6],
    "doors": [4],
    "current": ["AC_20000_50hz", "DC_1500"],
    "usage": ["express"],
    "operator": ["tsukuba"],
    "capacity": [{ "headCapacity": [147], "wagCapacity": [158] }],
    "power": [{ "powerPerMotor": 190, "blockLength": 8, "positions": [1, 2, 3, 4] }],
    "liveries": [
      {
        "panto": {
          "variations": [
            {
              "placement": [
                { "length": 5, "positions": { "0": "mot", "2": "mot" } },
                { "length": 3, "positions": { "0": "mot" } }
              ],
              "main": { "0": "0", "5": "1", "2..3": "1" }
            }
          ]
        }
      }
    ],
    "spriteSets": [
      [
        ["front", "tmpl_std (0, 0)"],
        ["end", "tmpl_std (0, 25)"],
        ["mot", "tmpl_std (0, 50)"],
        ["wag", "tmpl_symm (0, 75)"]
      ]
    ]
  },
  {
    "descName": "string(STR_TRAIN_NAME_SHORT, \"TX-3000\", string(STR_NAME_SERIES))",
    "trainName": "tsukuba_3000series",
    "groupType": "semiPrivate",
    "introductionDate": "2020, 3, 14",
    "scrapYear": 0,
    "costFactor": 21,
    "runningCost": 52,
    "speed": 130,
    "trackGauge": 1067,
    "weight": [37, 34],
    "formations": [6],
    "doors": [4],
    "current": ["AC_20000_50hz", "DC_1500"],
    "usage": ["express"],
    "operator": ["tsukuba"],
    "capacity": [{ "headCapacity": [140], "wagCapacity": [151] }],
    "power": [{ "powerPerMotor": 190, "blockLength": 8, "positions": [1, 2, 3, 4] }],
    "liveries": [
      {
        "panto": {
          "variations": [
            {
              "placement": [
                { "length": 5, "positions": { "0": "mot", "2": "mot" } },
                { "length": 3, "positions": { "0": "mot" } }
              ],
              "main": { "0": "0", "5": "1", "2..3": "1" }
            }
          ]
        }
      }
    ],
    "spriteSets": [
      [
        ["front", "tmpl_std (0, 0)"],
        ["end", "tmpl_std (0, 25)"],
        ["mot", "tmpl_std (0, 50)"],
        ["wag", "tmpl_symm (0, 75)"]
      ]
    ]
  }
]
